id;question;mediaReference;points;typeId;correctAnswerId
1873;Co może być przyczyną nadmiernego poślizgu tramwaju podczas rozruchu i hamowania?;8B204.jpg;3;2;4434
1874;W jakim przypadku zalecane jest stosowanie piasecznic stanowiących wyposażenie tramwaju?;8B205.jpg;3;2;4439
1875;Jakie czynniki mogą ograniczać pole widzenia motorniczego?;8B350.jpg;3;2;4440
1876;Który z wymienionych czynników może mieć wpływ na zmniejszenie pola widzenia motorniczego?;8B351.jpg;3;2;4444
1877;Czy wzrost prędkości może mieć wpływ na sposób postrzegania przez motorniczego?;8B352.jpg;3;2;4446
1878;Jaki czynnik może zakłócić prawidłowy sposób obserwacji drogi w czasie prowadzenia tramwaju w nocy?;8B353.jpg;3;2;4449
1879;Czy możesz przejeżdżać pod izolatorem sekcyjnym z wciśniętym pedałem jazdy (przyspieszenia)?;8B401.jpg;2;2;4453
1880;Podczas przejazdu przez jaką zwrotnicę ma miejsce jazda na/pod iglicę?;8B402.jpg;2;2;4456
1881;Co należy uwzględnić podczas przejazdu przez krzyżownicę tramwajową?;8B403.jpg;2;2;4459
1882;Jakie ustawienie nawrotnika może być przyczyną braku możliwości jazdy tramwajem dwu-wagonowym?;8B407.jpg;2;2;4462
1883;Jakie ustawienie nawrotnika może być przyczyną braku możliwości jazdy tramwajem jedno-wagonowym?;8B408.jpg;2;2;4464
1884;Jakie ustawienie nawrotnika może być przyczyną braku możliwości jazdy tramwajem dwu-wagonowym?;8B409.jpg;2;2;4468
1885;Co należy zrobić w przypadku pojawienia się nadmiernego poślizgu kół (buksowania) podczas rozruchu?;8B410.jpg;2;2;4471
1886;Jak powinieneś ustawić zwrotnicę najazdową sterowaną hydraulicznie w przypadku konieczności przejazdu podczas cofania składem dwu-wagonowym?;8B411.jpg;2;2;4473
1887;Jak powinieneś ustawić zwrotnicę zjazdową w przypadku konieczności przejazdu podczas cofania tramwajem?;8B412.jpg;2;2;4478
1888;Co służy do zmiany położenia iglicy w zwrotnicy sterowanej mechanicznie?;8B416.jpg;2;2;4480
1889;Co służy do zmiany prędkości jazdy?;8B417.jpg;2;2;4483
1890;Co umożliwia jazdę tramwajem do tyłu?;8B418.jpg;2;2;4485
1891;Czy możesz kontynuować jazdę z pasażerami, po stwierdzeniu awarii mechanizmu zamykania drugich drzwi, w pierwszym wagonie?;8C101.jpg;3;2;4488
1892;Których z podanych rodzajów hamulców, nie można sprawdzić na terenie zajezdni?;8C102.jpg;3;2;4492
1893;Którego, z podanych rodzajów hamulców, nie ma możliwości sprawdzić na terenie zajezdni?;8C103.jpg;3;2;4496
1894;Co, między innymi, należy sprawdzić przed przystąpieniem do jazdy tramwajem dwuwagonowym?;8C104.jpg;3;2;4498
1895;Co, między innymi, należy sprawdzić przed przystąpieniem do jazdy tramwajem?;8C105.jpg;3;2;4500
1896;W jakiej pozycji powinien znajdować się sprzęg podczas łączenia wagonów tramwajowych?;8C106.jpg;3;2;4504
1897;Czego nie należy robić w trakcie sprzęgania ze sobą dwóch wagonów?;8C107.jpg;3;2;4506
1898;Czego nie należy robić w trakcie sprzęgania ze sobą dwóch wagonów?;8C108.jpg;3;2;4509
1899;Czym może być spowodowane rozłączenie stycznika liniowego w tramwaju?;8C109.jpg;3;2;4514
1900;Jaki dokument uprawnia do kierowania tramwajem?;8C250.jpg;1;2;4517
1901;Co mogą spowodować niskie obrzeża kół biegowych?;8C301.jpg;1;2;4518
1902;Co może spowodować wyszczerbiona wkładka grafitowa pantografu?;8C302.jpg;1;2;4522
1903;Czym może być spowodowane samoczynne załączenie się hamulców szynowych?;8C303.jpg;1;2;4526
1904;Co należy zrobić w przypadku braku zadziałania zwrotnicy zdalnie sterowanej?;8C304.jpg;1;2;4527
1905;Jaka powinna być odległość dolnej krawędzi odgarniacza od główki szyny?;8C306.jpg;1;2;4532
1906;Co może być przyczyną wydobywania się dymu z wózka napędowego?;8C307.jpg;1;2;4534
1907;Czy w przypadku stwierdzenia przepalenia jednej linki bocznikującej w pantografie dalsza jazda może być kontynuowana?;8C308.jpg;1;2;4538
1908;W jaki sposób należy wykonać nagłe hamowanie tramwajem?;8C310.jpg;2;2;4541
1909;Co może spowodować uszkodzona przetwornica wirująca?;8C311.jpg;1;2;4544
1910;W jakiej sytuacji zaleca się stosowanie piasecznic znajdujących się na wyposażeniu tramwaju?;8C312.jpg;2;2;4547
1911;Co powinieneś zrobić kierując tramwajem wyposażonym w piasecznice w przypadku braku piasku w zbiornikach?;8C313.jpg;2;2;4550
1912;O czym należy pamiętać przed rozpoczęciem holowania  składu tramwajów, uszkodzonego w wyniku kolizji?;8D101.jpg;2;2;4553
1913;O czym należy pamiętać przed rozpoczęciem spychania składu tramwajów, uszkodzonego w wyniku kolizji ?;8D102.jpg;2;2;4555
1914;O czym należy pamiętać podczas spychania uszkodzonego w wyniku kolizji składu tramwajów?;8D103.jpg;2;2;4557
1915;Co powinieneś zrobić w przypadku agresywnego zachowania pasażera wobec Ciebie lub innych pasażerów, gdy sytuacja utrudnia kierowanie pojazdem?;8D150.jpg;2;2;4561
1916;O co należy zadbać, w pierwszej kolejności, w przypadku pożaru tramwaju podczas jazdy?;8D151.jpg;2;2;4563
1917;W jaki sposób zorganizować ewakuację pasażerów, jeżeli w wyniku wypadku drogowego nastąpiła blokada drzwi?;8D152.jpg;2;2;4567
1918;Jak należy się zachować w przypadku pożaru wewnątrz tramwaju, podczas jazdy?;8D153.jpg;2;2;4571
1919;Czy w tej sytuacji wolno Ci zawrócić na skrzyżowaniu?;1A303.wmv;3;1;4573
1920;Czy w tej sytuacji masz prawo użyć sygnału dźwiękowego, aby ostrzec pieszego o niebezpieczeństwie?;634.D33_org.wmv;1;1;4574
1921;Czy w tej sytuacji powinieneś zmienić pas ruchu na środkowy, jeśli chcesz jechać na wprost?;IMG_8931orgbm.jpg;2;1;4576
1922;Czy w tej sytuacji masz prawo użyć sygnału dźwiękowego, aby ostrzec pieszego o niebezpieczeństwie?;626.D33_1org.wmv;1;1;4578
1923;Czy ze względów bezpieczeństwa wskazane jest, aby używając gaśnicy samochodowej, unikać pełnego otwarcia pokrywy komory silnika?;R_2org.wmv;1;1;4580
1924;Czy w tej sytuacji uzasadnione jest sprawdzenie, czy sprawca wypadku zaciągnął hamulec awaryjny i wyłączył silnik?;R_1org.wmv;1;1;4582
1925;Czy w przedstawionej sytuacji jesteś ostrzegany o niebezpieczeństwie wynikającym z nieoczekiwanej zmiany kierunku ruchu?;A-30 z T-18 (7)org.jpg;2;1;4584
1926;Czy ten znak ostrzega o zbliżaniu się do skrzyżowania z jednokierunkową drogą podporządkowaną, której wlot znajduje się po lewej stronie?;1A1124.wmv;2;1;4587
1927;Czy ten znak ostrzega o zbliżaniu się do skrzyżowania z drogą podporządkowaną znajdującą się po lewej stronie?;1A1125.wmv;2;1;4588
1928;Czy ten znak wskazuje, że jadąc samochodem osobowym masz obowiązek skręcić w prawo na najbliższym skrzyżowaniu?;1A1316.jpg;1;1;4591
1929;Czy jadąc samochodem osobowym możesz skręcić w prawo na tak oznakowaną drogę?;1A1329.jpg;1;1;4592
1930;Czy jadąc samochodem osobowym o dopuszczalnej masie całkowitej 3 tony możesz skręcić w prawo za tym znakiem?;1A1330.jpg;1;1;4594
1931;Czy w tej sytuacji, jadąc na wprost, masz obowiązek umożliwić przejazd pojazdowi uprzywilejowanemu, który skręca w lewo?;1A4126.wmv;3;1;4596
1932;Czy w tej sytuacji masz pierwszeństwo przed tramwajem?;1A4224.wmv;3;1;4599
1933;Czy w tej sytuacji masz obowiązek ustąpić pierwszeństwa tramwajowi?;1A4225.wmv;3;1;4600
1934;Czy widoczny na skrzyżowaniu sygnał zielony oznacza bezkolizyjny skręt w lewo?;1A4304.wmv;3;1;4603
1935;Czy w tej sytuacji możesz opuścić skrzyżowanie?;1A4310.wmv;3;1;4604
1936;Czy w tej sytuacji masz prawo wjechać na skrzyżowanie z dowolnego pasa ruchu, jeśli zamierzasz skręcić w lewo?;1A5114.wmv;2;1;4607
1937;Czy w tej sytuacji możesz zatrzymać pojazd na środkowym pasie jezdni?;1A5118.wmv;2;1;4609
1938;Czy na tym skrzyżowaniu masz prawo skręcić w lewo z zajmowanego pasa ruchu?;1A5232.jpg;2;1;4610
1939;Czy na tym skrzyżowaniu możesz zawrócić z lewego pasa ruchu?;1A5233.jpg;2;1;4612
1940;Czy w tej sytuacji masz prawo wyprzedzić tramwaj z lewej strony?;1A5309.wmv;3;1;4615
1941;Czy za tym znakiem masz prawo wyprzedzić pojazd uprzywilejowany?;1A5312.wmv;3;1;4616
1942;Czy w tej sytuacji masz obowiązek zachować szczególną ostrożność?;1B121.wmv;2;1;4618
1943;Czy w tej sytuacji masz obowiązek ustąpić pierwszeństwa pieszym?;1B224.wmv;3;1;4620
1944;Czy w tej sytuacji masz prawo przejechać przed pieszymi?;1B225.wmv;3;1;4623
1945;Czy w tej sytuacji powinieneś zachować szczególną ostrożność a w razie potrzeby zatrzymać się?;1B361.wmv;3;1;4624
1946;Czy w tej sytuacji możesz wyprzedzić rowerzystę?;1B410.wmv;3;1;4627
1947;Czy kierujący właściwie zabezpieczył pojazd przed jego opuszczeniem?;1B414.wmv;2;1;4628
1948;Czy kierujący właściwie zabezpieczył pojazd na czas postoju?;1B415.wmv;2;1;4631
1949;Czy zachowanie kierującego, który pozostawił samochód na postoju jest poprawne?;1B416.wmv;2;1;4633
1950;Czy zatrzymując na tej drodze pojazd, który uległ awarii, masz obowiązek umieścić ostrzegawczy trójkąt odblaskowy w odległości 100 m za nim?;1C123.jpg;1;1;4634
1951;Czy na drodze ekspresowej, podczas postoju pojazdu silnikowego, który uległ awarii, masz obowiązek przez cały czas to sygnalizować?;1C180.jpg;1;1;4636
1952;Kiedy należy przeprowadzać okresowe badanie techniczne pojazdu samochodowego?;2C250.jpg;1;2;4640
1953;Jaka maksymalna liczba motocykli ma prawo jechać w zorganizowanej kolumnie?;3A108.jpg;3;2;4641
1954;Której z tych czynności nie masz prawa wykonywać, gdy kierujesz motocyklem?;3C105.jpg;2;2;4645
1955;Czy masz prawo kierować holowanym motocyklem, jeśli nie posiadasz prawa jazdy uprawniającego do kierowania nim?;3C116.jpg;2;2;4647
1956;Który z dokumentów masz obowiązek posiadać przy sobie kierując motocyklem zarejestrowanym za granicą, którego nie jesteś właścicielem?;3C212.jpg;1;2;4651
1957;Co powinieneś zrobić przed sprawdzeniem poziomu oleju w silniku?;3C304.jpg;1;2;4655
1958;Którym z wymienionych pojazdów masz prawo wjechać na tak oznakowaną drogę?;4A111.jpg;2;2;4658
1959;Czy ciągnik rolniczy powinien być wyposażony w gaśnicę?;4A215.jpg;2;2;4659
1960;Jaki odstęp powinieneś zachować jadąc za innym pojazdem?;4B170.jpg;3;2;4663
1961;Jak, w przybliżeniu, wzrasta długość drogi hamowania pojazdu przy dwukrotnie większej prędkości?;4B171.jpg;3;2;4665
1962;Na co, przede wszystkim, powinieneś zwrócić uwagę podczas wymijania innego pojazdu?;4B172.jpg;3;2;4670
1963;Od czego, w szczególności, zależy bezpieczny odstęp, który powinieneś zachować jadąc za innym pojazdem?;4B173.jpg;3;2;4671
1964;Czego możesz się spodziewać, podczas gwałtownego hamowania, w takich warunkach drogowych?;4B174.jpg;3;2;4676
1965;Od czego powinna być uzależniona odległość ciągnika rolniczego, od pojazdu poprzedzającego?;4B175.jpg;3;2;4677
1966;Czy wymijając w nocy inny pojazd, który oświetla drogę przed sobą, powinieneś uwzględnić, że może to ograniczać Twoją zdolność dostrzegania przeszkód na jezdni?;4B271.jpg;2;2;4680
1967;Czy w czasie jazdy w nocy należy zwiększyć uwagę?;4B272.jpg;2;2;4683
1968;Który z wymienionych czynników może mieć wpływ na obserwację drogi przez kierującego ciągnikiem rolniczym?;4B273.jpg;2;2;4686
1969;Co może zakłócić właściwy sposób obserwacji drogi, gdy w nocy kierujesz ciągnikiem rolniczym?;4B274.jpg;2;2;4689
1970;Jaka adnotacja jest wymagana w dowodzie rejestracyjnym, aby ciągnik rolniczy wchodzący w skład kolejki turystycznej mógł być dopuszczony do ruchu?;4C204.jpg;1;2;4692
1971;Który z dokumentów jest wymagany do zarejestrowania ciągnika rolniczego?;4C206.jpg;1;2;4696
1972;W jakim terminie należy przeprowadzać okresowe badanie techniczne przyczepy rolniczej podlegającej rejestracji?;4C212.jpg;1;2;4699
1973;Ile razy w tygodniu, dzienny czas prowadzenia pojazdu, kierowcy wykonującego przewóz drogowy, może zostać przedłużony do 10 godzin?;5A306.jpg;3;2;4702
1974;Do jakiego rodzaju czynności kierowcy zalicza się nadzór nad wyładunkiem?;5A334.jpg;3;2;4705
1975;Który czynnik ma zasadniczy wpływ na bezpieczeństwo, gdy wymijasz inny pojazd?;5B172.jpg;3;2;4709
1976;Czego możesz się spodziewać podczas gwałtownego hamowania w takich warunkach drogowych?;5B174.jpg;3;2;4712
1977;Czym może być spowodowana mała skuteczność hamulców samochodu ciężarowego?;5C308.jpg;1;2;4713
1978;Co stanowi obowiązkowe wyposażenie autobusu, którego dopuszczalna prędkość wynosi 100 km/h?;6A204.jpg;2;2;4717
1979;Jakiej prędkości nie pozwala przekroczyć homologowany ogranicznik prędkości, w który jest wyposażony autobus?;6A205.jpg;2;2;4719
1980;Ile godzin minimalnie powinien wynosić nieprzerwany dzienny odpoczynek kierowcy załogi kilkuosobowej?;6A304.jpg;3;2;4724
1981;Do ilu godzin maksymalnie możesz przedłużyć dzienny czas prowadzenia pojazdu wykonując przewóz drogowy?;6A307.jpg;3;2;4725
1982;Do jakiego rodzaju czynności kierowcy zalicza się sprawdzanie i kompletowanie dokumentów dotyczących przewozu?;6A339.jpg;3;2;4728
1983;Jak powinieneś kierować autobusem podczas jazdy po łuku drogi?;6B309.jpg;3;2;4731
1984;Jaki rodzaj oleju silnikowego należy stosować do silników wysokoprężnych wykorzystywanych w autobusach?;6C304.jpg;1;2;4736
1985;Jaki olej należy zastosować w celu uzupełnienia stanu oleju, znajdującego się w silniku autobusu?;6C305.jpg;1;2;4738
1986;Czy w tej sytuacji za tym znakiem masz obowiązek sygnalizowania zamiaru zmiany pasa ruchu?;1A1333a.wmv;1;1;4740
1987;Czy w tej sytuacji kontynuując jazdę masz obowiązek sygnalizować zamiar zmiany pasa ruchu?;1A1323a.wmv;1;1;4742
1988;Czy w tej sytuacji możesz ominąć pojazd, który zatrzymał się, aby przepuścić pieszego?;1A1108a.wmv;2;1;4745
1989;Czy przejeżdżając obok tego przystanku tramwajowego, masz obowiązek zachować szczególną ostrożność?;AK_D10_28_org.wmv;2;1;4746
1990;Czy w tej sytuacji wolno Ci wjechać za sygnalizator, jeżeli zatrzymanie się przed nim wymaga gwałtownego hamowania?;1A311.wmv;3;1;4748
1991;Czy przyczepa specjalna, przystosowana wyłącznie do ciągnięcia przez ciągnik rolniczy lub pojazd wolnobieżny, wymaga rejestracji?;4C207.jpg;1;2;4751
1992;W jaki sposób wykorzystuje się odpoczynek z tytułu rekompensaty za skrócony tygodniowy okres odpoczynku?;6A310.jpg;3;2;4753
1993;Czy w tej sytuacji, powinieneś wziąć pod uwagę możliwość wtargnięcia pieszych na jezdnię?;3444orgbm.jpg;3;1;4756
1994;Czy podczas wyprzedzania rowerzysty, w warunkach zmniejszonej przejrzystości powietrza, poza obszarem zabudowanym, powinieneś używać krótkotrwałych sygnałów dźwiękowych?;1B356.jpg;3;1;4758
1995;Czy w tej sytuacji masz obowiązek zachować ostrożność?;1A4414.wmv;3;1;4760
1996;Czy kierując pojazdem w stanie pobudzenia emocjonalnego, zwiększasz precyzję i trafność swoich reakcji w sytuacji niebezpiecznej?;W20(31).wmv;2;1;4763
1997;Czy w tej sytuacji masz prawo wyprzedzić tramwaj?;W12(174).wmv;3;1;4764
1998;Z jaką prędkością nie możesz poruszać się w strefie zamieszkania?;2A118.jpg;3;2;4768
1999;Uczestniczyłeś w wypadku drogowym, w którym są ranni. Czy wolno Ci podejmować czynności, które mogłyby utrudnić ustalenie przebiegu wypadku?;DSC_0178z.jpg;1;1;4770
2000;Czy w tym miejscu wolno Ci zmienić dotychczas zajmowany pas ruchu na pas przy prawej krawędzi jezdni?;IMG_0393d5_orgbezmaski.jpg;1;1;4772
2001;Czy na obszarze zabudowanym masz obowiązek włączyć światła awaryjne, aby sygnalizować postój uszkodzonego pojazdu, który znajduje się poza jezdnią?;1C118.jpg;1;1;4774
2002;Czy w tej sytuacji na obszarze zabudowanym masz obowiązek umożliwić włączenie się do ruchu autobusowi, jeśli kierujący nim sygnalizuje taki zamiar?;1A4103.wmv;3;1;4775
2003;Czy kierując pojazdem samochodowym o dopuszczalnej masie całkowitej 2,5 t, na obszarze zabudowanym, na tak oznakowanej drodze, możesz jechać z prędkością 70 km/h?;5A106.jpg;3;2;4777
2004;Z jaką maksymalną dopuszczalną prędkością możesz jechać, kierując samochodem osobowym o dopuszczalnej masie całkowitej 3 t, na drodze ekspresowej jednojezdniowej?;5A109.jpg;3;2;4781
2005;Czy skręcając w lewo masz obowiązek ustąpić pierwszeństwa pojazdowi jadącemu z przeciwka?;1A4210.wmv;3;1;4784
2006;Na co nie możesz pozwolić pasażerowi, którego przewozisz motocyklem?;3C104.jpg;2;2;4787
2007;Czy w tej sytuacji możesz skręcić w prawo przed tramwajem?;1A4209.wmv;3;1;4789
2008;Zamierzasz skręcić w lewo. Czy masz pierwszeństwo przed skręcającym w lewo motocyklistą?;KW_D22_429_org_2.wmv;3;1;4790
2009;Czy w przedstawionej sytuacji jesteś ostrzegany o zbliżaniu się do skrzyżowania z drogą podporządkowaną?;3595.wmv;2;1;4792
2010;Czy w przedstawionej sytuacji zbliżasz się do prawostronnego zwężenia jezdni?;4089.wmv;2;1;4794
2011;Czy w przedstawionej sytuacji jesteś ostrzegany o lewostronnym zwężeniu jezdni?;4047.wmv;2;1;4796
2012;Czy w przedstawionej sytuacji jesteś ostrzegany o dwóch niebezpiecznych zakrętach, z których pierwszy jest w prawo?;3864.wmv;2;1;4798
2013;Czy widoczna pod znakiem ostrzegawczym tabliczka wskazuje na nieoczekiwaną zmianę kierunku ruchu?;3730.wmv;2;1;4800
2014;Czy w przedstawionej sytuacji zbliżasz się do wielotorowego przejazdu kolejowego?;4115.wmv;2;1;4802
2015;Czy umieszczona pod widocznym znakiem ostrzegawczym tabliczka wskazuje nieoczekiwaną zmianę kierunku ruchu?;3845.wmv;2;1;4804
2016;Czy w przedstawionej sytuacji jesteś ostrzegany o zbliżaniu się do skrzyżowania z drogą z pierwszeństwem z prawej strony?;3826.wmv;2;1;4807
2017;Czy w tej sytuacji, znak ostrzegawczy oznacza, że zbliżasz się do kilku niebezpiecznych zakrętów, z których pierwszy jest w prawo?;3972.wmv;2;1;4809
2018;Czy w tej sytuacji, znak ostrzegawczy oznacza, że zbliżasz się do miejsca, w którym rozpoczyna się ruch dwukierunkowy?;3617.wmv;2;1;4810
2019;Czy umieszczona pod widocznym znakiem ostrzegawczym tabliczka wskazuje odległość znaku od miejsca niebezpiecznego?;3549.wmv;2;1;4813
2020;Czy w tej sytuacji masz obowiązek jazdy na wprost?;3533.wmv;3;1;4814
2021;Czy w tej sytuacji, na skrzyżowaniu, wolno Ci  poruszać się w kierunku przeciwnym do wskazanego na znaku nakazu?;3596.wmv;3;1;4817
2022;Czy wolno Ci zatrzymać się na odcinku jezdni przed widocznym znakiem w celu wysadzenia pasażera?;3878.wmv;3;1;4819
2023;Czy w tej sytuacji sygnał świetlny zabrania Ci zawracania na skrzyżowaniu?;4105.wmv;3;1;4821
2024;Czy w tej sytuacji wolno Ci zawrócić na najbliższym skrzyżowaniu?;4029.wmv;3;1;4823
2025;Czy w przedstawionej sytuacji jesteś zobowiązany do zatrzymania pojazdu przed przejściem dla pieszych?;3855.wmv;1;1;4825
2026;Czy w tej sytuacji wolno Ci zawrócić?;3916.wmv;3;1;4827
2027;Czy widoczny po lewej stronie jezdni znak zakazu zabrania Ci zawracania na najbliższym skrzyżowaniu?;L4T2_033.wmv;3;1;4828
2028;Czy w tej sytuacji wolno Ci skręcić w prawo bez zatrzymania się?;L2T2_021_b.wmv;3;1;4831
2029;Czy w tej sytuacji masz obowiązek ustąpić pierwszeństwa tylko pojazdom nadjeżdżającym z prawej strony?;L5T2_022_3.wmv;3;1;4833
2030;Czy w przedstawionej sytuacji masz obowiązek ustąpić pierwszeństwa rowerzyście?;3509_3.wmv;3;1;4835
2031;Czy zakaz wyrażony tym znakiem dotyczy wyłącznie tej strony drogi, po której znak się znajduje?;L4T2_030_b_3.wmv;3;1;4836
2032;Zatrzymałeś się przed przejściem dla pieszych. Czy masz również obowiązek zatrzymać się przed linią widoczną bezpośrednio za przejściem?;L5T2_027_b_3.wmv;3;1;4838
2033;Czy w tej sytuacji jesteś informowany o końcu drogi z pierwszeństwem przejazdu?;3600_3.wmv;1;1;4840
2034;Czy umieszczona pod widocznym znakiem tabliczka wskazuje rzeczywisty przebieg drogi z pierwszeństwem przez skrzyżowanie?;4061_3.wmv;1;1;4842
2035;Czy ten znak pionowy informuje Cię o lokalizacji schroniska młodzieżowego?;3895_3.wmv;1;1;4844
2036;Czy widoczny po prawej stronie jezdni znak pionowy, wskazuje dozwolone kierunki jazdy z poszczególnych pasów ruchu?;3901_3.wmv;1;1;4846
2037;Czy widoczna pod znakiem tabliczka wskazuje odległość znaku ostrzegawczego od miejsca niebezpiecznego?;3935_3.wmv;2;1;4848
2038;Czy w tej sytuacji wolno Ci skręcić w lewo z zajmowanego pasa ruchu?;3941_3.wmv;1;1;4851
2039;Czy ten znak informuje Cię, że zbliżasz się do końca autostrady?;3981_3.wmv;1;1;4852
2040;Czy z zajmowanego obecnie pasa ruchu wolno Ci skręcić w lewo na najbliższym skrzyżowaniu?;3987_3.wmv;1;1;4855
2041;Czy na widocznym skrzyżowaniu wolno Ci skręcić w prawo z zajmowanego obecnie pasa ruchu?;3818_3.wmv;1;1;4857
2042;Czy w tej sytuacji masz pierwszeństwo przed pojazdem nadjeżdżającym z przeciwka?;4110_3.wmv;1;1;4858
2043;Czy widoczna pod znakiem tabliczka informuje o miejscu przeznaczonym do parkowania wyłącznie dla pojazdów samochodowych oznaczonych kartą parkingową?;4028_3.wmv;1;1;4860
2044;Czy widoczny po prawej stronie znak pionowy informuje Cię o miejscu przejeżdżania rowerzystów w poprzek drogi?;L3T1_038_c_3.wmv;1;1;4862
2045;Czy widoczny znak pionowy informuje Cię, że zbliżasz się do restauracji i hotelu?;L4T1_074_b_3.wmv;1;1;4864
2046;Czy w tej sytuacji wolno Ci rozpocząć wyprzedzanie?;4051.wmv;1;1;4867
2047;Czy w tej sytuacji masz obowiązek zmienić obecnie zajmowany pas ruchu?;3949.wmv;1;1;4868
2048;Czy w przedstawionej sytuacji wolno Ci najeżdżać na widoczną na jezdni podwójną linię ciągłą?;3967.wmv;1;1;4871
2049;Czy w tej sytuacji masz obowiązek zmienić obecnie zajmowany pas ruchu?;3720.wmv;1;1;4872
2050;Czy poruszając się tym pasem ruchu, masz obowiązek kontynuować jazdę na wprost przez skrzyżowanie?;3711.wmv;1;1;4874
2051;Czy w tej sytuacji masz obowiązek sygnalizować zamiar zmiany pasa ruchu?;3707.wmv;2;1;4876
2052;Czy w tym miejscu wolno Ci zmienić pas ruchu na lewy?;3904.wmv;1;1;4879
2053;Czy w tej sytuacji wolno Ci zatrzymać pojazd na powierzchni wyłączonej z ruchu?;4094.wmv;1;1;4881
2054;Czy na tym skrzyżowaniu wolno Ci zawrócić z zajmowanego obecnie pasa ruchu?;L2T2_016.wmv;1;1;4882
2055;Czy w przedstawionej sytuacji poruszasz się drogą jednokierunkową?;L2T2_009_b.wmv;1;1;4885
2056;Czy na tym skrzyżowaniu wolno Ci skręcić tylko w lewo?;L2T3_028.wmv;1;1;4887
2057;Czy w tej sytuacji wolno Ci skręcić w lewo z zajmowanego obecnie pasa ruchu?;L4T1_013.wmv;1;1;4889
2058;Czy na tym odcinku drogi wolno Ci rozpocząć wyprzedzanie pojazdu?;L4T1_073.wmv;1;1;4891
2059;Czy na tym odcinku drogi wolno Ci rozpocząć wyprzedzanie pojazdu?;L4T1_074.wmv;1;1;4893
2060;Czy na tym skrzyżowaniu wolno Ci skręcić w prawo z zajmowanego obecnie pasa ruchu?;L4T2_019.wmv;1;1;4895
2061;Czy w tej sytuacji wolno Ci wjeżdżać na widoczną z lewej strony powierzchnię jezdni?;L2T2_032.wmv;1;1;4897
2062;Czy w tej sytuacji wolno Ci skręcić w lewo, aby zaparkować pojazd na chodniku?;L6T1_030_b.wmv;1;1;4899
2063;Czy w tej sytuacji wolno Ci wykorzystać widoczną po lewej stronie powierzchnię jezdni do parkowania pojazdu?;L6T1_031_b.wmv;1;1;4901
2064;Czy ten sygnał świetlny oznacza, że przy skręcaniu w lewo nie występuje kolizja z innymi uczestnikami ruchu?;3515.wmv;3;1;4903
2065;Czy w tej sytuacji wolno Ci przejechać na wprost przez skrzyżowanie bez zatrzymania się?;3517.wmv;3;1;4904
2066;Czy w tej sytuacji migający sygnał świetlny zabrania Ci wjazdu za sygnalizator?;3521.wmv;3;1;4907
2067;Czy w tej sytuacji wolno Ci przejechać przez przejście dla pieszych bez zatrzymywania się?;4031.wmv;3;1;4908
2068;Czy w tej sytuacji migający sygnał świetlny ostrzega o występującym niebezpieczeństwie lub utrudnieniu ruchu?;3705.wmv;3;1;4910
2069;Czy w tej sytuacji wolno Ci skręcić w prawo na tym skrzyżowaniu?;4016.wmv;3;1;4913
2070;Czy w tej sytuacji wolno Ci wjechać za sygnalizator bez zatrzymania się?;3588.wmv;3;1;4914
2071;Czy w tej sytuacji masz obowiązek zatrzymać się przed widoczną linią poprzeczną?;3559.wmv;3;1;4916
2072;Czy w tej sytuacji wolno Ci skręcić w prawo bez zatrzymania się?;3528_3.wmv;3;1;4919
2073;Czy w tej sytuacji wolno Ci skręcić w prawo po upewnieniu się, że tym manewrem nie utrudnisz ruchu innym uczestnikom?;3500.wmv;3;1;4921
2074;Czy w tej sytuacji masz prawo wjechać na skrzyżowanie?;L5T1_037_1.wmv;3;1;4922
2075;Jedziesz na wprost, a kierujący pojazdem nadjeżdżającym z przeciwka zamierza skręcić w lewo. Czy masz obowiązek ustąpić mu pierwszeństwa?;4151.wmv;3;1;4925
2076;Czy w tej sytuacji, wjeżdżając na drogę poprzeczną, włączasz się do ruchu?;4160.wmv;3;1;4926
2077;Czy skręcając w lewo, masz obowiązek ustąpić pierwszeństwa pojazdowi jadącemu z przeciwka?;4135.wmv;3;1;4928
2078;Czy w tej sytuacji masz obowiązek ustąpić pierwszeństwa pojazdom poruszającym się po drodze twardej, na którą wjeżdżasz?;L3T3_005.wmv;3;1;4930
2079;Zamierzasz skręcić w prawo. Czy masz pierwszeństwo przed pojazdami jadącymi drogą poprzeczną?;L3T3_006.wmv;3;1;4933
2080;Czy w tej sytuacji masz obowiązek ustąpić pierwszeństwa pojazdom nadjeżdżającym z lewej strony?;3614.wmv;3;1;4934
2081;Czy w tej sytuacji wolno Ci zmienić zajmowany obecnie pas ruchu i skręcić w prawo?;4019.wmv;1;1;4937
2082;Czy umieszczona pod tym znakiem informacyjnym tabliczka wskazuje układ dróg podporządkowanych?;3724.wmv;1;1;4938
2083;Czy ten znak zakazu zabrania Ci skrętu w prawo na najbliższym skrzyżowaniu?;3756.wmv;3;1;4940
2084;Czy w tej sytuacji migający sygnał świetlny zakazuje Ci wjazdu na przejazd tramwajowy?;4148.wmv;3;1;4943
2085;Czy w tej sytuacji masz pierwszeństwo przed pojazdem nadjeżdżającym z prawej strony?;3804.wmv;3;1;4944
2086;Czy w tej sytuacji masz pierwszeństwo przed pojazdem nadjeżdżającym z lewej strony?;3785.wmv;3;1;4947
2087;Czy w tej sytuacji masz obowiązek ustąpić pierwszeństwa pojazdowi nadjeżdżającemu z lewej strony?;3717.wmv;3;1;4948
