id;question;mediaReference;points;typeId;correctAnswerId
2888;Czy w tej sytuacji wolno Ci zatrzymać samochód osobowy kołami jednego boku na chodniku po prawej stronie jezdni?;1675ztV_2.wmv;3;1;6854
2889;Czy w tej sytuacji wolno Ci się zatrzymać przy lewej krawędzi jezdni?;1675ztV_2.wmv;2;1;6855
2890;Czy widoczny znak wskazuje pasy ruchu przeznaczone do jazdy w podanych kierunkach?;1676ztV_2.wmv;1;1;6857
2891;Czy w tej sytuacji wolno Ci zawrócić?;1676ztV_2.wmv;1;1;6860
2892;Czy na najbliższym skrzyżowaniu wolno Ci skręcić w lewo?;1677ztV_2.wmv;1;1;6861
2893;Czy ten znak oznacza koniec drogi z pierwszeństwem?;1678ztV_2.wmv;1;1;6864
2894;Czy w tej sytuacji zbliżasz się do skrzyżowania z drogą podporządkowaną?;1678ztV_2.wmv;1;1;6865
2895;Czy w tej sytuacji zbliżasz się do przejazdu kolejowego?;1679ztV_2.wmv;2;1;6868
2896;Czy w tej sytuacji należy się zatrzymać przed sygnalizatorem jeśli nie wymaga to gwałtownego hamowania?;1680ztV_2.wmv;3;1;6869
2897;Czy w tej sytuacji następnym sygnałem dla pasa ruchu, którym się poruszasz będzie sygnał czerwony?;1680ztV_2.wmv;3;1;6871
2898;Czy widoczna pod znakiem ostrzegawczym tabliczka wskazuje układ torów i drogi na przejeździe tramwajowym?;1681ztV_2.wmv;1;1;6873
2899;Czy w tej sytuacji należy zachować szczególną ostrożność?;1681ztV_2.wmv;1;1;6875
2900;Czy w tej sytuacji wolno Ci skręcić w prawo bez zatrzymania się przed sygnalizatorem?;1683ztV_2.wmv;3;1;6878
2901;Czy w tej sytuacji wolno Ci skręcić w prawo zanim pieszy wejdzie na zajmowany przez Ciebie pas ruchu?;1683ztV_2.wmv;3;1;6880
2902;Czy sygnał żółty migający oznacza, że za chwilę zapali się sygnał zielony?;1684ztV_2.wmv;3;1;6882
2903;Czy sygnał żółty migający oznacza, że za chwilę zapali się sygnał czerwony?;1684ztV_2.wmv;3;1;6884
2904;Czy w tej sytuacji ograniczenie prędkości dotyczy tylko skrajnego prawego pasa ruchu?;1686ztV_2.wmv;1;1;6886
2905;Zamierzasz skręcić w lewo na skrzyżowaniu. Czy masz obowiązek sygnalizować ten manewr lewym kierunkowskazem?;1687ztV_2.wmv;1;1;6887
2906;Czy w tej sytuacji należy zachować szczególną ostrożność?;1688ztV_2.wmv;2;1;6889
2907;Czy w tej sytuacji zbliżasz się do przejścia dla pieszych, które jest szczególnie uczęszczane przez dzieci?;1689ztV_2.wmv;1;1;6891
2908;Czy w tej sytuacji należy zachować szczególną ostrożność mimo, że w okolicy przejścia nie widać pieszych?;1689ztV_2.wmv;1;1;6893
2909;Czy przed tak oznakowanym przejściem dla pieszych należy zawsze się zatrzymać?;1689ztV_2.wmv;1;1;6896
2910;Czy w tej sytuacji zbliżasz się do stacji obsługi technicznej?;1690ztV_2.wmv;1;1;6897
2911;Czy w tej sytuacji wolno Ci jeszcze zmienić pas ruchu na lewy?;1691ztV_2.wmv;1;1;6899
2912;Czy w tej sytuacji wolno Ci się zatrzymać przy prawej krawędzi jezdni?;1691ztV_2.wmv;2;1;6902
2913;Poruszasz się autostradą i zamierzasz ją opuścić. Czy hamowanie rozpoczniesz po wjeździe na pas wyłączenia (zjazdu)?;1691ztV_2.wmv;2;1;6903
2914;Czy w tej sytuacji wolno Ci zmienić pas na lewy?;1694ztV_2.wmv;1;1;6906
2915;Czy w tej sytuacji wolno Ci się zatrzymać przy żółtej linii po prawej?;1694ztV_2.wmv;1;1;6908
2916;Czy wolno Ci rozpocząć wyprzedzanie pod wiaduktem?;1697ztV_2.wmv;3;1;6909
2917;Czy w tej sytuacji wolno Ci kontynuować jazdę zajmowanym pasem, jeżeli dwa pasy po prawej są wolne?;1698ztV_2.wmv;1;1;6911
2918;Czy w tej sytuacji wolno Ci jeszcze zmienić pas na prawy?;1698ztV_2.wmv;1;1;6913
2919;Czy na autostradzie wolno Ci poruszać się dowolnym pasem ruchu niezależnie od sytuacji na drodze?;1699ztV_2.wmv;2;1;6916
2920;Czy w tej sytuacji jesteś informowany o zbliżaniu się do punktu poboru opłat za przejazd autostradą?;1700ztV_2.wmv;1;1;6918
2921;Zamierzasz zjechać z autostrady w kierunku Pruszkowa. Czy powinieneś zmienić pas ruchu na prawy?;1701ztV_2.wmv;1;1;6919
2922;Czy w tej sytuacji znaki informują Cię o końcu pasa ruchu po prawej stronie jezdni?;1703ztV_2.wmv;1;1;6922
2923;Czy w tej sytuacji znaki informują Cię o końcu pasa ruchu po lewej stronie jezdni?;1703ztV_2.wmv;1;1;6923
2924;Czy w tej sytuacji znaki informują Cię o końcu drogi ekspresowej?;1704ztV_2.wmv;1;1;6925
2925;Poruszasz się z prędkością 110 km/h. Czy w tej sytuacji masz obowiązek zmniejszyć prędkość?;1704ztV_2.wmv;2;1;6928
2926;Czy w tej sytuacji ograniczenie prędkości 90 km/h dotyczy tylko jednego skrajnego prawego pasa ruchu?;1709ztV_2.wmv;3;1;6930
2927;Czy w tej sytuacji wolno Ci jeszcze zmienić pas ruchu na prawy?;1710ztV_2.wmv;2;1;6932
2928;Kierujesz samochodem osobowym. Czy w tej sytuacji za widocznym znakiem wolno Ci wyprzedzać?;1712ztV_2.wmv;3;1;6933
2929;Czy w tej sytuacji wolno Ci kontynuować jazdę środkowym pasem ruchu?;1715ztV_2.wmv;1;1;6935
2930;Czy w tej sytuacji należy sygnalizować manewr wyprzedzania odpowiednim kierunkowskazem?;1716ztV_2.wmv;3;1;6937
2931;Czy w tej sytuacji należy zatrzymać się przed sygnalizatorem?;1717ztV_2.wmv;2;1;6940
2932;Czy w tej sytuacji należy sygnalizować zamiar zmiany pasa prawym kierunkowskazem?;1718ztV_2.wmv;2;1;6941
2933;Czy w tej sytuacji wjeżdżasz na autostradę?;1719ztV_2.wmv;1;1;6944
2934;"Czy w przedstawionej sytuacji kierujący pojazdami koloru czerwonego i zielonego zgodnie z przepisami umożliwiają przejazd pojazdu uprzywilejowanego tworząc tzw. ""korytarz życia"" ?";W11 korytarz  z 005.jpg;2;1;6946
2935;Czy w przedstawionej sytuacji kierujący zespołem pojazdów nr 1 zachował się właściwie?;W11 korytarz z 003n.jpg;2;1;6947
2936;"Czy w przedstawionej sytuacji kierujący pojazdami zgodnie z przepisami umożliwili swobodny przejazd pojazdu uprzywilejowanego, tworząc tzw. ""korytarz życia"" ?";W11 korytarz  z 001.jpg;2;1;6949
2937;Czy w tej sytuacji bezpośrednio za pojazdem uprzywilejowanym dozwolone jest poruszanie się dowolnych pojazdów?;W11 korytarz z 002n.jpg;2;1;6952
2938;Czy w warunkach znacznego zmniejszenia prędkości na jezdni kierujący pojazdem nr 3 przejeżdża przed pojazdem nr 2?;W11 suwak z 001n.jpg;2;1;6954
2939;Czy w warunkach  znacznego zmniejszenia prędkości na jezdni kierujący pojazdem nr 2 przejeżdża przed pojazdem nr 3?;W11 suwak z 001n.jpg;2;1;6955
2940;Czy w warunkach znacznego zmniejszenia prędkości na jezdni kierujący pojazdem nr 3 przejeżdża przed pojazdem nr 2?;W11 suwak z 002n.jpg;2;1;6958
2941;Czy w warunkach znacznego zmniejszenia prędkości na jezdni kierujący pojazdem nr 3 ma obowiązek umożliwić kierującemu pojazdem nr 2 zmianę pasa ruchu?;W11 suwak z 002n.jpg;2;1;6959
2942;Czy w warunkach znacznego zmniejszenia prędkości na jezdni kierujący pojazdem nr 4 przejeżdża przed kierującym pojazdem nr 2?;W11 suwak z 003n.jpg;2;1;6962
2943;Czy kierujący zespołem pojazdów, który zatrzymał się na środku tej jezdni, zachował się prawidłowo wobec kierującego pojazdem uprzywilejowanym straży pożarnej  ?;W10_korytarz_202.jpg;2;1;6964
2944;"Czy kierujący pojazdami utworzyli prawidłowo ""korytarz życia"" w celu umożliwienia swobodnego przejazdu pojazdu uprzywilejowanego ?";W10_korytarz_205.jpg;2;1;6965
2945;Czy kierujący pojazdami w sposób właściwy umożliwili swobodny przejazd pojazdu uprzywilejowanego?;W10_korytarz_204.jpg;2;1;6968
2946; Czy wszyscy kierujący w sposób właściwy zapewniają swobodny przejazd pojazdu uprzywilejowanego ?;W10_korytarz_203.jpg;2;1;6970
2947;Czy z drogi przejazdu pojazdu uprzywilejowanego utworzonej w sposób przedstawiony na zdjęciu może skorzystać  kierujący pojazdem pomocy drogowej biorący udział w akcji ratowniczej ?;W10_korytarz_201.jpg;2;1;6971
2948;Czy kierujący jadący lewym pasem ruchu ciągnikiem siodłowym z cysterną ma obowiązek już w tym miejscu umożliwić pojazdowi jadącemu przed Tobą zmianę pasa ruchu na sąsiedni?;W11_suwak_307.jpg;2;1;6974
2949;Czy kierujący pojazdem poruszający się sąsiednim pasem ruchu jest obowiązany bezpośrednio przed miejscem zanikania pasa ruchu umożliwić pojazdowi jadącemu przed Tobą zmianę pasa ruchu na prawy?;W11_suwak_304.jpg;2;1;6975
2950;Czy w tej sytuacji kierujący pojazdem poruszającym się prawym pasem ruchu jest obowiązany umożliwić tobie   zmianę pasa ruchu ?;W11_suwak_302.jpg;2;1;6977
2951;Czy kierujący poruszający się prawym pasem ruchu jest obowiązany umożliwić już w tym miejscu zmianę pasa ruchu pojazdowi jadącemu przed Tobą?;W11_suwak_306.jpg;2;1;6980
2952;Czy kierujący pojazdem poruszającym się prawym pasem ruchu po ominięciu tego znaku ma obowiązek umożliwić Tobie zmianę pasa ruchu ?;W11_suwak_303.jpg;2;1;6982
2953;Czy kierujący pojazdem koloru białego znajdujący się na lewym pasie ruchu w sposób właściwy umożliwia przejazd pojazdu uprzywilejowanego ?;w11korytarz zycia_001.wmv;2;1;6983
2954;"Czy pokazana sytuacja przedstawia poprawnie utworzony ""korytarz życia""?";w11korytarz zycia 002.wmv;2;1;6985
2955;Czy w przedstawionej sytuacji żółty pojazd pomocy drogowej biorący udział w akcji ratowniczej może poruszać się po drodze przejazdu pojazdu uprzywilejowanego ?;w11korytarz zycia_001.wmv;2;1;6987
2956;Czy w tej sytuacji kierujący pojazdem nr 1 ma obowiązek zjechać jak najbliżej lewej krawędzi pasa ruchu?;W11-korytarz-004.wmv;2;1;6989
2957;Czy w tej sytuacji kierujący pojazdem nr 1 ma obowiązek usunąć się z drogi przejazdu pojazdu uprzywilejowanego ?;W11-korytarz-005.wmv;2;1;6991
2958;Czy w tej sytuacji kierujący pojazdem nr 1 ma obowiązek zjechać w prawo ?;W11-korytarz-005.wmv;2;1;6993
2959;Czy w tej sytuacji, w warunkach znacznego zmniejszenia prędkości na jezdni, pojazd koloru białego poruszający się prawym pasem może wjechać na sąsiedni pas ruchu ?;W11-suwak-001.wmv;2;1;6995
2960;Czy w tej sytuacji, w warunkach znacznego zmniejszenia prędkości na jezdni, masz obowiązek umożliwić wjazd pojazdowi ciężarowemu z przyczepą?;W11-suwak-002.wmv;2;1;6997
2961;Czy w przedstawionej sytuacji masz prawo liczyć, że poruszający się obok pojazd umożliwi tobie zmianę pasa ruchu?;w11 suwak 003.wmv;2;1;6999
2962;Czy kierujący pojazdem nr 1 ma obowiązek umożliwić zmianę pasa ruchu pojazdowi nr 2?;W11-suwak-004.wmv;2;1;7002
2963;Czy w tej sytuacji kierujący pojazdem nr 1 ma obowiązek umożliwić zmianę pasa ruchu kierującemu pojazdem nr 2?;W11-suwak-005.wmv;2;1;7003
2964;"Czy kierujący tymi pojazdami umożliwili swobodny przejazd pojazdom uprzywilejowanym tworząc tzw. ""korytarz życia""?";w10_korytarz_208.wmv;2;1;7005
2965;Czy kierujący pojazdem ciężarowym, zatrzymując się w tym miejscu postąpił zgodnie z obowiązującymi przepisami ?;w10_korytarz_209.wmv;2;1;7008
2966;Czy kierujący pojazdami w sposób zgodny z obowiązującymi przepisami usunęli się z drogi przejazdu pojazdu uprzywilejowanego ?;w10_korytarz_210.wmv;2;1;7010
2967;Czy w wyjątkowej sytuacji np.ratowania życia, przy zachowaniu szczególnej ostrożności,możesz skorzystać z drogi pojazdu uprzywilejowanego?;W10_korytarz_200.jpg;2;1;7012
2968;Czy w przedstawionej sytuacji kierujący pojazdami są obowiązani umożliwić zmianę pasa ruchu pojazdom znajdującym się na pasie zanikającym ?;W11-suwak-309.wmv;2;1;7014
2969;Czy masz obowiązek umożliwić zmianę pasa ruchu pojazdowi nadjeżdżającemu z prawej strony?;W11-suwak-310.wmv;2;1;7016
2970;"Czy kierujący ma obowiązek stosować tzw. ""jazdę na suwak"",  gdy nie ma znacznego zmniejszenia prędkości ?";W11_suwak_305.jpg;2;1;7018
2971;Czy w tej sytuacji wolno Ci skręcić w prawo na skrzyżowaniu?;1_1369ztV.wmv;2;1;7019
2972;Czy w przedstawionej sytuacji obowiązany jesteś zachować szczególną ostrożność?;AKADEMIA_1.jpg;3;1;7021
2973;Czy dozwolony jest postój na wyznaczonych miejscach dla osób niepełnosprawnych, jeśli nie będzie trwał więcej niż 15 minut?;AKADEMIA_2.jpg;1;1;7024
2974;Czy dozwolony jest postój na wyznaczonych miejscach dla osób niepełnosprawnych, jeżeli posiadana przez kierującego karta parkingowa straciła ważność?;AKADEMIA_2.jpg;1;2;7027
2975;Czy poruszając się pojazdem jednośladowym masz prawo jechać utworzonym przez innych kierujących tzw. „korytarzem życia”?;3.JPG;2;1;7029
2976;Czy masz obowiązek zbliżyć się do prawej krawędzi jezdni, by umożliwić przejazd pojazdu uprzywilejowanego, który nadjeżdża z tyłu?;4.JPG;2;1;7030
2977;Czy nadawany sygnał oznacza, że za chwilę zapali się sygnał zielony?;AKADEMIA_4.jpg;3;1;7032
2978;Czy nadawany sygnał oznacza, że za chwilę zapali się sygnał czerwony?;AKADEMIA_4.jpg;3;1;7035
2979;Czy w przedstawionej sytuacji kierujący obowiązany jest przepuścić pojazd z prawej strony?;AKADEMIA_5.jpg;3;1;7036
2980;Czy w przedstawionej sytuacji kierujący jest obowiązany zatrzymać pojazd przed jezdnią przy linii złożonej z trójkątów?;AKADEMIA_6.jpg;3;1;7039
2981;Czy w przedstawionej sytuacji dozwolona jest dalsza jazda przez skrzyżowanie?;AKADEMIA_6.jpg;3;1;7041
2982;Czy w przedstawionej sytuacji dozwolona jest dalsza jazda przez skrzyżowanie, jeżeli nastąpi zatrzymanie pojazdu przed sygnalizacją?;AKADEMIA_6.jpg;3;1;7043
2983;Czy po zapaleniu sygnału zielonego dozwolone będzie zawracanie z obecnie zajmowanego pasa ruchu?;AKADEMIA_6.jpg;1;1;7045
2984;Czy po zapaleniu sygnału zielonego dozwolona będzie jazda w prawo z obecnie zajmowanego pasa ruchu?;AKADEMIA_6.jpg;1;1;7046
2985;Czy w widocznej sytuacji kierujący może włączyć światła drogowe?;AKADEMIA_7.jpg;1;1;7049
2986;Czy kierując pojazdem nienormatywnym masz obowiązek mieć przy sobie i okazywać uprawnionym osobom zezwolenie na przejazd?;Zezwolenie.jpg;2;2;7050
2987;Czy poruszając się pojazdem nienormatywnym o rzeczywistej masie całkowitej powyżej 80 ton występuje obowiązek pilotowania takiego pojazdu przez dwa pojazdy pilotujące?;80ton_2pilotow.jpg;2;2;7053
2988;Czy poruszając się pojazdem nienormatywnym o szerokości ponad 3,6 m zachodzi obowiązek pilotowania takiego pojazdu przez dwa pojazdy pilotujące?;szerokosc_2pilotow.jpg;2;2;7056
2989;Czy poruszając się pojazdem nienormatywnym o długości ponad 30 m zachodzi obowiązek pilotowania takiego pojazdu przez dwa pojazdy pilotujące?;30m_pilot.jpg;2;2;7059
2990;Czy poruszając się pojazdem nienormatywnym o rzeczywistej masie całkowitej powyżej 60 ton występuje obowiązek pilotowania takiego pojazdu?;60ton_pilotowanie.jpg;2;2;7062
2991;Czy poruszając się pojazdem nienormatywnym o szerokości ponad 3,2 m występuje obowiązek pilotowania takiego pojazdu?;szerokosc_pilot.jpg;2;2;7065
2992;Czy poruszając się pojazdem nienormatywnym o długości ponad 23 m występuje obowiązek pilotowania takiego pojazdu?;dlugosc_pilotowanie.jpg;2;2;7068
2993;Czy poruszając się pojazdem nienormatywnym kierujący ma obowiązek przestrzegać warunków przejazdu wskazanych w zezwoleniu odpowiedniej kategorii?;warunki_zezwolenia.jpg;2;2;7071
2994;Czy poruszając się pojazdem nienormatywnym kierujący ma obowiązek zachować szczególną ostrożność?;ostroznosc.jpg;2;2;7074
2995;Czy poruszając się zespołem pojazdów o wysokości większej niż 4 m wymagane jest zezwolenie?;wysokosc.jpg;2;2;7077
2996;Czy poruszając się pojazdem o szerokości większej niż 2,6 wymagane jest zezwolenie na przejazd pojazdu normatywnego?;zezwolenie_kat_VI.jpg;2;2;7080
2997;Czy poruszając się pojazdem o rzeczywistej macie całkowitej 50 ton lub więcej wymagane jest zezwolenie odpowiedniej kategorii na przejazd pojazdu nienormatywnego?;50ton.jpg;2;2;7083
2998;Czy masz obowiązek stosować się do poleceń lub sygnałów dawanych przez pilota pojazdu nienormatywnego?;;1;1;7086
2999;Przewożenie dziecka w foteliku bezpieczeństwa zamontowanym tyłem do kierunku jazdy na przednim siedzeniu pojazdu samochodowego, wyposażonego w poduszkę powietrzną dla pasażera jest:;;2;2;7090
3000;Przewożenie dziecka siedzącego tyłem do kierunku jazdy w urządzeniu przytrzymującym dla dzieci, zamontowanym na przednim siedzeniu pojazdu samochodowego wyposażonego w poduszkę powietrzną jest:;;2;2;7091
3001;Przewożenie samochodem osobowym dziecka w wieku poniżej 3 lat jest:;;2;2;7095
3002;Przewożenie dziecka w wieku poniżej trzech lat samochodem osobowym, niewyposażonym w pasy bezpieczeństwa i fotelik bezpieczeństwa dla dziecka lub w pasy bezpieczeństwa i inne urządzenie przytrzymujące dla dzieci jest:;;2;2;7097
3003;Przewożenie dziecka na przednim siedzeniu samochodu bez fotelika bezpieczeństwa dla dziecka jest:;;2;2;7100
3004;Obowiązek korzystania z pasów bezpieczeństwa:;;2;2;7104
3005;Dziecko mające mniej niż 150 cm wzrostu, przewożone samochodem osobowym wyposażonym w pasy bezpieczeństwa, powinno znajdować się w foteliku bezpieczeństwa dla dziecka, zgodnym z:;;2;2;7106
3006;Jeżeli w samochodzie osobowym na tylnym siedzeniu przewożonych jest dwoje dzieci w fotelikach bezpieczeństwa i nie ma możliwości zainstalowania trzeciego fotelika, to:;;2;2;7110
3007;Przewożenie na tylnym siedzeniu samochodu osobowego dziecka przytrzymywanego za pomocą pasów bezpieczeństwa jest:;;2;2;7112
3008;Foteliki bezpieczeństwa dla dzieci oraz inne urządzenia przytrzymujące dla dzieci należy instalować w pojeździe:;;2;2;7117
3009;"Policjant zatrzyma prawo jazdy za pokwitowaniem w przypadku ujawnienia czynu polegającego na:


Policjant zatrzyma";;2;2;7119
3010;Policjant zatrzyma wydane w kraju prawo jazdy za pokwitowaniem, w przypadku ujawnienia czynu polegającego na przewożeniu osób samochodem osobowym, w liczbie przekraczającej liczbę miejsc określoną w dowodzie rejestracyjnym o:;;2;2;7123
3011;Pokwitowanie zatrzymania wydanego w kraju prawa jazdy z powodu przekroczenia przez kierującego dopuszczalnej prędkości o więcej niż 50 km/h na obszarze zabudowanym, uprawnia do kierowania pojazdem w okresie:;;2;2;7126
3012;Starosta wydaje decyzję administracyjną o zatrzymaniu prawa jazdy, gdy kierujący pojazdem przekroczył dopuszczalną prędkość o:;;2;2;7127
3013;Jeżeli pomimo decyzji o zatrzymaniu prawa jazdy na 3 miesiące osoba nadal kierowała pojazdem, starosta przedłuża okres, na który zatrzymano prawo jazdy do:;;2;2;7130
3014;Policjant zatrzyma za pokwitowaniem, wydane w kraju prawo jazdy, w przypadku ujawnienia czynu polegającego na przewożeniu autobusem osób, w liczbie przekraczającej liczbę miejsc określoną w dowodzie rejestracyjnym o:;;2;2;7135
3015;W przypadku gdy kierujący przekroczył dopuszczalną prędkość o więcej niż 50 km/h na obszarze zabudowanym, starosta wydaje decyzję administracyjną o zatrzymaniu prawa jazdy na okres:;;2;2;7138
3016;W przypadku gdy kierujący pojazdem silnikowym przewozi osoby w liczbie przekraczającej liczbę miejsc określoną w dowodzie rejestracyjnym, starosta wydaje decyzję administracyjną o zatrzymaniu prawa jazdy na okres:;;2;2;7139
3017;Jeżeli osoba kierowała pojazdem silnikowym pomimo wydania decyzji administracyjnej o zatrzymaniu prawa jazdy i przedłużeniu okresu zatrzymania prawa jazdy do 6 miesięcy, starosta wydaje decyzję administracyjną o:;;2;2;7144
3018;Policjant zatrzyma, za pokwitowaniem, prawo jazdy wydane przez państwo inne niż Rzeczpospolita Polska, w przypadku ujawnienia czynu polegającego na przewożeniu samochodem osobowym:;;2;2;7146
3019;Kierujący pojazdem, zarejestrowanym na terytorium Rzeczypospolitej Polskiej, jest zobowiązany mieć przy sobie i okazywać do kontroli dokument:;;2;2;7150
3020;Kierujący pojazdem, zarejestrowanym na terytorium Rzeczypospolitej Polskiej, jest zobowiązany mieć przy sobie i okazywać na żądanie uprawnionego organu:;;2;2;7151
3021;Obowiązek posiadania przy sobie prawa jazdy, wydanego na terytorium RP, dotyczy:;;2;2;7156
3022;Dokumentem stwierdzającym dopuszczenie pojazdu samochodowego do ruchu jest:;;2;2;7157
3023;Kierujący pojazdem zarejestrowanym za granicą, uczestniczącym w ruchu na terytorium RP, jest obowiązany mieć przy sobie i okazywać na żądanie upoważnionego organu:;;2;2;7160
3024;Policjant zatrzyma dowód rejestracyjny pojazdu w razie stwierdzenia, że:;;2;2;7163
3025;Utrzymywanie tablic rejestracyjnych w należytym stanie i zapewnienie ich czytelności:;;2;2;7167
3026;Kierujący pojazdem, zarejestrowanym na terytorium Rzeczypospolitej Polskiej,  jest obowiązany mieć przy sobie i okazywać na żądanie uprawnionego organu:;;2;2;7170
3027;Kierujący pojazdem, zarejestrowanym na terytorium RP oraz posiadający prawo jazdy wydane przez organy RP, jest obowiązany mieć przy sobie i okazywać na żądanie uprawnionego organu:;;2;2;7172
3028;Kierujący pojazdem, zarejestrowanym na terytorium RP, posiadający prawo jazdy wydane przez organy RP, jest obowiązany mieć przy sobie i okazywać na żądanie uprawnionego organu:;;2;2;7177
3029;Pojazd zarejestrowany na terytorium RP jest usuwany z drogi na koszt właściciela w przypadku:;;2;2;7180
3030;Kierujący samochodem osobowym zarejestrowanym za granicą i uczestniczącym w ruchu na terytorium RP jest obowiązany mieć przy sobie i okazywać na żądanie uprawnionego organu:;;2;2;7181
3031;Kierujący pojazdem wykonujący jazdę testową z wykorzystaniem profesjonalnego dowodu rejestracyjnego jest obowiązany mieć przy sobie i okazywać na żądanie uprawnionego organu:;;2;2;7185
3032;W jaki sposób przewozisz dziecko o wzroście mniejszym niż 150 cm na przednim siedzeniu samochodu osobowego, który ma pięć miejsc siedzących?;;2;2;7188
3033;Kierujący pojazdem zarejestrowanym na terytorium RP i posiadający uprawnienia wydane przez organy RP jest obowiązany mieć przy sobie i okazywać na żądanie uprawnionego organu:;;2;2;7192
3034;Brak przy sobie wydanego w kraju prawa jazdy, podczas kierowania samochodem osobowym po drogach publicznych w Polsce:;;2;2;7193
3035;Kierujący pojazdem zarejestrowanym na terytorium RP i posiadający uprawnienia wydane przez organy RP jest obowiązany mieć przy sobie i okazywać na żądanie uprawnionego organu:;;2;2;7197
3036;Do czego jest uprawniony policjant podczas kontroli ruchu drogowego?;;2;2;7199
3037;Czy w tej sytuacji skręcając w prawo masz obowiązek przepuścić pieszych przechodzących drogą, w którą skręcasz?;W5.1.wmv;3;1;7202
3038;Czy w tej sytuacji możesz jechać na wprost przez skrzyżowanie?;W5.1.jpg;3;1;7205
3039;Czy po zmianie sygnału na zielony, ruszając będziesz włączającym się do ruchu?;W5.1.jpg;3;1;7207
3040;Czy w tej sytuacji masz obowiązek zachować szczególną ostrożność?;W7.7.wmv;3;1;7208
3041;Czy sygnał ten zezwala na skręt w prawo na skrzyżowaniu?;W8.4.wmv;3;1;7211
3042;Czy w tej sytuacji możesz jechać na wprost przez skrzyżowanie?;W5.2.jpg;3;1;7213
3043;Czy w tej sytuacji możesz skręcić w prawo?;W5.2.jpg;3;1;7215
3044;Czy w tej sytuacji masz obowiązek zachować szczególną ostrożność?;W5.2.jpg;3;1;7216
3045;Czy w tej sytuacji można skręcić w prawo?;W5.3.jpg;3;1;7218
3046;Czy po tych sygnałach zaświeci się sygnał czerwony?;W5.2.jpg;3;1;7221
3047;Czy po tych sygnałach zaświeci się sygnał zielony?;W5.2.jpg;3;1;7222
3048;Czy w tej sytuacji kierujący powinien przygotować się do wznowienia jazdy?;W5.2.jpg;3;1;7224
3049;Czy w tej sytuacji możesz jechać na wprost przez skrzyżowanie?;W5.3.jpg;3;1;7226
3050;Czy sygnał ten zezwala Ci na skręcenie w prawo na skrzyżowaniu?;W5.4.jpg;3;1;7228
3051;Czy w tej sytuacji, gdy zamierzasz skręcić w prawo na skrzyżowaniu, masz obowiązek zatrzymać się przed sygnalizatorem?;W5.1.wmv;3;1;7231
3052;Czy w tej sytuacji, zjeżdżając z chodnika na jezdnię, jesteś włączającym się do ruchu?;W6.1.wmv;3;1;7232
3053;Czy włączając się do ruchu masz obowiązek zachować szczególną ostrożność?;W6.1.wmv;3;1;7234
3054;Czy włączając się do ruchu masz obowiązek ustąpić pierwszeństwa innym uczestnikom ruchu?;W6.1.wmv;3;1;7236
3055;Czy w tej sytuacji jesteś włączającym się do ruchu?;W6.3.wmv;3;1;7239
3056;Czy na tym skrzyżowaniu, skręcając w lewo, masz obowiązek ustąpić pierwszeństwa pojazdom nadjeżdżającym z prawej strony?;W6.5.wmv;3;1;7240
3057;Czy w tej sytuacji, skręcając w lewo na skrzyżowaniu, masz pierwszeństwo przed pojazdami nadjeżdżającym z prawej strony?;W6.5.wmv;3;1;7243
3058;Czy w tej sytuacji masz obowiązek zachować szczególną ostrożność?;W6.5.wmv;3;1;7244
3059;Czy w tej sytuacji, skręcając w prawo na skrzyżowaniu, masz pierwszeństwo przejazdu?;W6.5.wmv;3;1;7246
3060;Czy w tej sytuacji dojeżdżasz do skrzyżowania, gdzie pierwszeństwo nie jest określone znakami drogowymi?;W6.5.wmv;3;1;7248
3061;W jaki sposób przewozisz dziecko o wzroście mniejszym niż 150 cm samochodem osobowym, w którym jest pięć miejsc siedzących?;;2;2;7251
3062;Czy w tej sytuacji, skręcając w lewo na skrzyżowaniu, masz pierwszeństwo przed pojazdami nadjeżdżającymi z prawej strony?;W6.5.wmv;3;1;7254
3063;W jaki sposób zainstalujesz w pojeździe fotelik bezpieczeństwa służący do przewozu dziecka?;;2;2;7257
3064;W jaki sposób w pojeździe zainstalujesz podtrzymujące dziecko urządzenie, które służy do jego przewozu?;;2;2;7260
3065;Czy skręcając w prawo na tym skrzyżowaniu musisz ustąpić pierwszeństwa pojazdom, które nadjeżdżałyby z lewej strony?;W6.5.wmv;3;1;7262
3066;Jakie warunki powinien spełniać samochód osobowy, którym chcesz przewieźć dziecko, które ma mniej niż trzy lata?;;2;2;7263
3067;Czy w tej sytuacji, skręcając w prawo na skrzyżowaniu, masz obowiązek ustąpić pierwszeństwa pojazdom nadjeżdżającym z lewej strony?;W6.6.wmv;3;1;7267
3068;Czym powinieneś się kierować wybierając fotelik lub urządzenie przytrzymujące służące do przewozu dziecka?;;2;2;7269
3069;Czy znak ten ostrzega o skrzyżowaniu dróg równorzędnych?;W6.5.wmv;3;1;7271
3070;Jakie muszą być spełnione warunki podczas przewożenia dziecka na tylnym siedzeniu samochodu osobowego?;;2;2;7273
