id;question;mediaReference;points;typeId;correctAnswerId
811;Czy na tym skrzyżowaniu motorniczy ma obowiązek ustąpić pierwszeństwa pojazdom jadącym drogą poprzeczną?;129TRAM3org.wmv;3;1;1704
812;Czy za widocznym znakiem masz obowiązek ustąpić pierwszeństwa przejazdu także pojazdom, które nadjeżdżałyby jezdnią z prawej strony?;265TRAM2org.jpg;3;1;1706
813;Czy w tej sytuacji masz pierwszeństwo przejazdu przed pojazdami, które jadą obok Ciebie i zamierzają jechać dalej na wprost?;208TRAM3org.wmv;3;1;1708
814;Czy w tym miejscu przecięcia torów masz pierwszeństwo przed tramwajem, który nadjechałby z lewej strony?;209TRAM1org.wmv;3;1;1711
815;Czy motorniczy ma prawo zwiększyć prędkość, gdy tramwaj, który prowadzi, jest wyprzedzany?;029TRAM3org.wmv;2;1;1713
816;Czy konieczność zachowania bezpiecznego odstępu od wolniej jadącego obok Ciebie pojazdu może wymagać zmniejszenia prędkości?;027TRAM3org.wmv;2;1;1714
817;Czy podczas omijania masz w każdym przypadku obowiązek zachować bezpieczny odstęp?;032TRAM3po korekcie.jpg;2;1;1716
818;Czy w tej sytuacji motorniczy wykonuje manewr wymijania?;033TRAM2org.wmv;2;1;1718
819;Czy w tej sytuacji wykonujesz manewr omijania?;035TRAM2org.wmv;2;1;1721
820;Czy w każdym przypadku masz obowiązek zachować odległość co najmniej 1 metra od omijanego pojazdu, uczestnika ruchu lub przeszkody?;;2;1;1723
821;Czy motorniczy, który nie ma możliwości obserwacji drogi za tramwajem, może cofać, nie zapewniając sobie pomocy innej osoby?;;2;1;1725
822;Czy motorniczy, który źle przełożył zwrotnicę i zauważył to ok. 1 m za nią, ma prawo wycofać tramwaj nie sprawdzając, czy nie spowoduje tym zagrożenia?;;2;1;1727
823;Czy masz obowiązek zachować szczególną ostrożność, gdy omijasz pojazd przewożący zorganizowaną grupę dzieci do 18 lat, które z niego wysiadają?;;2;1;1728
824;Jakiego rodzaju hamulcem jest hamulec postojowy?;;1;2;1731
825;Jaki skutek wywoła zatrzymanie wagonu w miejscu styku pantografu z izolatorem?;;1;2;1733
826;Czy wobec pieszych zachowujących się w widoczny sposób należy zastosować zasadę ograniczonego zaufania?;040TRAM3.wmv;3;1;1736
827;W jakich sytuacjach motorniczy może wpuścić lub wypuścić pasażera, któremu się bardzo śpieszy?;;3;2;1739
828;Które, z tych oznaczeń tramwaju, oprócz oznakowania liniowego, jest wymagane?;;1;2;1741
829;W jakich miejscach motorniczy może wpuszczać lub wypuszczać pasażerów?;;3;2;1745
830;Czy za widocznym na pierwszym planie znakiem ostrzegawczym powinieneś spodziewać się ruchu rowerzystów?;167TRAM1org.jpg;3;1;1747
831;Czy kierując tramwajem, masz obowiązek posiadać przy sobie pozwolenie na kierowanie tym pojazdem?;;1;2;1749
832;Jak należy postąpić w przypadku wymiany przepalonego bezpiecznika topikowego - wysokiego napięcia?;;1;2;1753
833;Co powinien zrobić motorniczy przed rozpoczęciem jazdy, bezpośrednio po zamknięciu drzwi?;;3;2;1755
834;Jaka pozycja motorniczego jest prawidłowa podczas ręcznego przestawiania zwrotnicy?;;3;2;1760
835;W jakim miejscu motorniczy może wypuścić pasażerów z powodu długotrwałych utrudnień w ruchu drogowym?;;3;2;1763
836;Co powinien zrobić motorniczy, aby bezpiecznie dokonać elektrycznego połączenia wagonów?;;3;2;1766
837;Jak powinien zachować się motorniczy przed wyjściem z kabiny na jezdnię, poza przystankiem, w celu ręcznego ustawienia zwrotnicy?;;3;2;1768
838;Co może być przyczyną przerwania jazdy w czasie rozruchu, jeżeli dzwoni dzwonek wewnętrzny i brak jest sygnalizacji zamkniętych drzwi?;;3;2;1771
839;Jak powinieneś zachować się, gdy kierujesz tramwajem w czasie burzy z wyładowaniami atmosferycznymi i obawiasz się uderzenia pioruna?;;3;2;1774
840;Jak powinien zachować się motorniczy przejeżdżając przez miejsca z obniżoną siecią trakcyjną np. pod wiaduktem?;;2;2;1776
841;W jaki sposób powinien jechać motorniczy zbliżając się do skrzyżowania?;;2;2;1779
842;W jakiej sytuacji motorniczy może bezpiecznie przejechać przez zwrotnicę?;;2;2;1784
843;Jakiego zachowania wymaga od motorniczego przejazd tramwajem przez zwrotnice i krzyżownice?;;2;2;1786
844;Jaką zasadą techniki jazdy powinien kierować się motorniczy wjeżdżając w ostry łuk toru?;;2;2;1790
845;Jaki wpływ na obsługę urządzeń sterujących ma ustawienie fotela motorniczego?;;2;2;1793
846;Jeśli wystąpi poślizg kół tramwaju w czasie rozruchu, należy go przerwać, a następnie:;;2;2;1794
847;Co powinien zrobić motorniczy podczas nagłego pojawienia się pojazdu na torach bezpośrednio przed tramwajem?;;2;2;1798
848;Jak należy prowadzić rozruch tramwaju?;;2;2;1800
849;Które hamulce są wykorzystane do łagodnego zatrzymania tramwaju na przystanku?;;1;2;1804
850;Jaki skutek może spowodować łuk elektryczny powstający przy przejeżdżaniu przez izolator z załączoną jazdą?;;2;2;1807
851;Kiedy motorniczy ma obowiązek dostosowania prędkości do warunków na drodze?;;2;2;1809
852;Co motorniczy powinien zrobić, gdy po wejściu pasażerów nie chcą się zamknąć drzwi i konieczna jest ich fachowa naprawa?;;3;2;1812
853;Co powinien zrobić motorniczy dojeżdżając do zanieczyszczonej zwrotnicy?;;1;2;1816
854;Co powinien zrobić motorniczy po ruszeniu tramwajem?;;2;2;1819
855;W jaki sposób motorniczy powinien przejeżdżać pod izolatorami sekcyjnymi umieszczonymi na sieci trakcyjnej?;;2;2;1822
856;Co spowoduje wciśnięcie czuwaka podczas postoju tramwaju?;;2;2;1825
857;Jaka jest maksymalna dopuszczalna prędkość tramwaju na obszarze zabudowanym w godzinach 5:00 - 23:00 (jeżeli znaki drogowe nie wskazują inaczej)?;;3;2;1828
858;Z czym powinien liczyć się motorniczy holując uszkodzony tramwaj?;;3;2;1831
859;Czy zmniejszenie prędkości tramwaju podczas przejeżdżania przez zwrotnicę jest konieczne?;;3;2;1834
860;Na jakim odcinku obowiązuje ograniczenie prędkości wynikające z tego znaku?;184TRAM3org.jpg;3;2;1838
861;Na jakim odcinku obowiązuje ograniczenie prędkości wynikające z tego znaku?;184TRAM3org.jpg;3;2;1840
862;Jak powinien zachować się motorniczy na odcinku za widocznym znakiem zakazu?;184TRAM3org.jpg;3;2;1843
863;Jaki skutek wywoła użycie piasecznic podczas rozruchu na śliskich szynach?;;2;2;1845
864;W którego rodzaju gaśnicę powinien być wyposażony tramwaj?;;2;2;1850
865;Czy jazda tramwajem bez osłony sprzęgów międzywagonowych od strony drzwi pasażerskich jest dozwolona?;;2;2;1853
866;W której sytuacji powinieneś używać świateł awaryjnych, jeżeli tramwaj jest w nie wyposażony?;;2;2;1856
867;W którym przypadku masz prawo wyjechać z zajezdni tramwajem z uszkodzonym zewnętrznym dzwonkiem ostrzegawczym?;;2;2;1858
868;Które hamulce pełnią w tramwaju funkcję awaryjnych?;;2;2;1862
869;"Do czego służy obwód blokady jazdy (""zielona linia"")?";;2;2;1864
870;Jaki skutek wywoła użycie piasecznic podczas hamowania na śliskich szynach?;;2;2;1867
871;W jaki sposób motorniczy może regulować siłę hamowania hamulców szynowych?;;3;2;1871
872;Jaki powinien być odstęp od poprzedzającego tramwaju podczas jazdy?;;3;2;1873
873;Które z wymienionych hamulców zostaną uruchomione, jeżeli puścisz czuwak podczas jazdy?;;3;2;1877
874;Jak należy się zachować wjeżdżając na przystanek?;;3;2;1879
875;W jaki sposób należy hamować po wyprowadzeniu tramwaju z poślizgu?;;3;2;1881
876;Co powinieneś założyć ustalając odstęp od poprzedzającego tramwaju?;;3;2;1884
877;Od czego może zależeć bezpieczny odstęp od poprzedzającego tramwaju?;;3;2;1888
878;Do czego powinna być dostosowana w szczególności prędkość tramwaju, od której zależy możliwość bezpiecznego zatrzymania się?;;3;2;1890
879;Jak powinieneś zachować się, gdy kierując tramwajem, zbliżasz się do kałuży znajdującej się na torowisku?;;3;2;1894
880;Jaki skutek wywołuje zalegająca na torach substancja, która powstała z wilgotnych liści?;;3;2;1898
881;Jaki wpływ na zachowanie tramwaju ma obecność liści na torowisku?;;3;2;1900
882;Jaki wpływ na stan torowiska ma początkowa faza opadów?;;3;2;1903
883;Kiedy opady deszczu mają największy wpływ na rozruch i hamowanie tramwaju?;;3;2;1905
884;Co zwiększa ryzyko wystąpienia poślizgu tramwaju?;;3;2;1910
885;W której porze roku warunki do jazdy tramwajem są najtrudniejsze?;;3;2;1913
886;Jak powienien zachować się motorniczy, jeżeli główki szyn są zalane wodą na znaczynym odcinku?;;3;2;1914
887;Jak powienien zachować się motorniczy, jeśli zauważy kamienie w rowkach szyn?;;3;2;1919
888;W jaki sposób powinno być ustawione wewnętrzne lusterko w tramwaju?;;3;2;1921
889;W jakiej sytuacji motorniczy może rozpocząć jazdę, jeśli pasażerowie nie odsunęli się od krawędzi przystanku?;;3;2;1924
890;Kiedy motorniczy może zwiększyć prędkość pokonując łuk drogi?;;2;2;1927
891;Co w tej sytuacji powinien zrobić motorniczy, bezpośrednio po zatrzymaniu tramwaju na przystanku?;184.2org.jpg;3;2;1929
892;W jakiej sytuacji, podczas jazdy, motorniczemu wolno wyłączyć blokadę jazdy?;;1;2;1934
893;W który z wymienionych systemów hamowania powinien być wyposażony każdy tramwaj liniowy?;;2;2;1936
894;Co należy sprawdzić w pierwszej kolejności jeśli po załączeniu jazdy tramwaj nie rusza?;;1;2;1940
895;Jakie napięcie powienien wskazywać woltomierz po włączeniu baterii?;;1;2;1943
896;Co powienien zrobić motorniczy, jeśli po załączeniu jazdy nie nastąpi odhamowanie hamulców szczękowych?;;1;2;1945
897;"Jaki skutek wywołuje wciśnięcie pedału lub wychylenie dźwigni hamulca elektordynamicznego ""za ogranicznik""?";;1;2;1947
898;Czym najczęściej spowodowany jest zanik rozruchu?;;1;2;1950
899;"Czy w tej sytuacji, jeżeli zamierzasz zjechać z autostrady, powinieneś przystąpić do zmiany pasa ruchu?""";IMG_7292d8orgbm.jpg;2;1;1953
900;Czy w tym miejscu obowiązuje zakaz zatrzymywania pojazdów?;W10(44)org.jpg;2;1;1955
901;Czy w tej sytuacji, jadąc na wprost, wolno Ci poruszać się bezpośrednio przy prawej krawędzi jezdni?;3138D15orgbm.jpg;2;1;1958
902;Czy w tej sytuacji wolno Ci wjechać na zwężony odcinek drogi bez zatrzymania się przed sygnalizatorem?;0686D18_aorgbm po korekcie.jpg;3;1;1959
903;Która z tych czynności zwiększy bezpieczeństwo jazdy, gdy kierujesz samochodem osobowym podczas mgły ograniczającej widoczność do 40 metrów?;;3;2;1963
904;Co zrobisz, by zmniejszyć efekt wewnętrznego zaparowania przedniej szyby podczas jazdy w deszczu?;;3;2;1965
905;Jak motorniczy powinien ustawić  prawe zewnętrzne lusterko?;;3;2;1968
906;Z jaką dopuszczalną prędkością możesz jechać w strefie zamieszkania?;;3;2;1972
907;Czy na najbliższym skrzyżowaniu torów powinieneś ustąpić pierwszeństwa tramwajowi, który nadjeżdżałby z prawej strony?;253TRAM1org.wmv;3;1;1973
908;Czy ze względu na nakaz zabezpieczenia pojazdu w czasie postoju wszystkie drzwi tramwaju powinny pozostać zamknięte, gdy w kabinie przebywa motorniczy?;;1;1;1976
909;Czy w tej sytuacji masz obowiązek zmniejszyć prędkość?;GIMBUS4Dorg.jpg;2;1;1977
910;Czy w tej sytuacji masz prawo kontynuować jazdę bez zwracania uwagi na zachowanie pieszego?;D24_11org.wmv;3;1;1980
911;Czy w tej sytuacji wolno Ci zawrócić?;3914D15_aorgbm.jpg;1;1;1981
912;Czy na zajmowanym pasie ruchu możesz spodziewać się rowerzystów, którzy pojadą na wprost?;4122D15_aorgbm.jpg;1;1;1983
913;Czy w tej sytuacji sygnał dawany przez policjanta zezwala na wjazd na skrzyżowanie?;065bD11orgbez maski.jpg;3;1;1986
914;Czy w przedstawionej sytuacji jesteś ostrzegany o zbliżaniu się do przejazdu kolejowego, wyposażonego w zapory lub półzapory?;IMG_9890d8org.jpg;2;1;1987
915;Czy w tym miejscu wolno Ci zawrócić?;IMG_028d9orgbm.jpg;2;1;1990
916;"Czy widoczny na jezdni znak ""stop"" uprzedza o zbliżaniu się do drogi z pierwszeństwem przejazdu?";2716D14MM_aorgbm.jpg;1;1;1991
917;Jak powinieneś zachować się, aby jechać z prędkością bezpieczną?;;3;2;1993
918;Czy w tej sytuacji po wyminięciu pojazdu masz prawo zmienić światła mijania na drogowe?;B.1.6.4.bzorg_skrocony.wmv;1;1;1996
919;Czy w tej sytuacji, kierując pojazdem samochodowym, wolno Ci używac wyłącznie świateł pozycyjnych?.;642.D33org.wmv;1;1;1999
920;Czy w przedstawionej sytuacji jesteś ostrzegany o skrzyżowaniu, na którym ruch odbywa się dookoła wyspy lub placu, w kierunku wskazanym na znaku?;1638D15org.jpg;2;1;2000
921;Czy w przedstawionej sytuacji jesteś ostrzegany o znacznym wzniesieniu drogi?;IMG_8800d8org.jpg;2;1;2002
922;Czy w tej sytuacji wolno Ci przejechać przez przejazd kolejowy bez zatrzymywania się, jeśli upewniłeś się wcześniej, że nie nadjeżdża pociąg?;049D16org.jpg;3;1;2005
923;Kierujesz pojazdem w obszarze zabudowanym. Czy w przedstawionej sytuacji masz obowiązek umożliwić kierującemu autobusem włączenie się do ruchu?;W9(32)org.wmv;3;1;2006
924;Czy w tej sytuacji jesteś uprzedzany o zbliżaniu się do skrzyżowania, na którym pierwszeństwo nie jest określone znakami?;1433D14MMorgbm.jpg;1;1;2008
925;Czy w tej sytuacji, przed wjechaniem na tory, masz obowiązek upewnić się czy nie zbliża się pojazd szynowy?;D18_1org.wmv;3;1;2010
926;Jedziesz na wprost, a motocyklista zamierza skręcić w lewo. Czy masz obowiązek ustąpić mu pierwszeństwa?;KW_D22_409_org.wmv;3;1;2012
927;Czy w tej sytuacji masz prawo rozpocząć manewr wyprzedzania?;GND14__3_org_2.wmv;3;1;2015
928;Zamierzasz skręcić w prawo, a kierujący autobusem chce skręcić w lewo. Czy masz przed nim pierwszeństwo?;W7(48)org.wmv;3;1;2017
929;Czy masz prawo ominąć poprzedzający pojazd z lewej strony?;W13(22)org.wmv;2;1;2019
930;Zamierzasz skręcić w prawo. Czy masz pierwszeństwo przed pojazdem nadjeżdżającym z lewej strony?;W6(43)org.wmv;3;1;2021
931;Jedziesz drogą z pierwszeństwem przejazdu. Czy w tej sytuacji masz pierwszeństwo przed rowerzystą?;W17(14,18,19)org.wmv;3;1;2023
932;Czy w tej sytuacji masz pierwszeństwo przed rowerzystą?;W17(15)org.wmv;3;1;2025
933;Czy masz prawo wjechać na chodnik, by ominąć ten pojazd?;W13(23)org.wmv;2;1;2027
934;Czy w tej sytuacji masz prawo jechać z włączonymi światłami drogowymi?;W14(28)org.wmv;1;1;2029
935;Czy po skręceniu w lewo, widoczne na jezdni poprzecznej oznakowanie poziome zabrania Ci przejechać na prawy skrajny pas ruchu?;W4(89)org.wmv;1;1;2031
936;Czy w tej sytuacji właściwie wybrałeś miejsce zatrzymania?;W16(29)org.wmv;3;1;2033
937;Czy prawidłowo omijasz poprzedzający pojazd?;W13(24)org.wmv;2;1;2034
938;Czy w tej sytuacji masz pierwszeństwo przed pojazdem nadjeżdżającym z lewej strony?;502_D27KW_org_2.wmv;3;1;2037
939;Czy w tej sytuacji, zanim włączysz się do ruchu, masz obowiązek obserwacji drogi w lusterku zewnętrznym?;D36_44org.wmv;3;1;2038
940;Jakie jest ryzyko poślizgu pojazdu podczas jazdy w czasie deszczu?;;3;2;2040
941;Jaki wpływ ma prędkość jazdy na kąt widzenia kierującego samochodem osobowym?;;2;2;2043
942;Który z wymienionych czynników może ograniczyć pole widzenia kierującego samochodem osobowym?;;2;2;2048
943;Który z wymienionych czynników może ograniczyć pole widzenia kierującego samochodem osobowym podczas jazdy nocą?;;2;2;2051
944;Który z wymienionych czynników ma wpływ na ograniczenie pola widzenia kierującego samochodem osobowym?;;2;2;2054
945;Który z wymienionych czynników może powodować ograniczenie pola widzenia kierującego samochodem osobowym?;;2;2;2055
946;Jaki wpływ ma prędkość jazdy na kąt widzenia kierującego samochodem osobowym?;;2;2;2059
947;Jedziesz z prędkością 80 km/h. Jaka pozycja początkowa zapewni Ci optymalny tor jazdy po zakręcie?;IMG_0027orgbm.jpg;2;2;2062
948;Jedziesz z prędkością 90 km/h. Jaka pozycja początkowa zapewni Ci optymalny tor jazdy po zakręcie?;IMG_9130d8orgbm.jpg;2;2;2066
949;Jak powinieneś postąpić, aby rozpędzić samochód osobowy na płaskim odcinku drogi?;;2;2;2068
950;W jaki sposób wolno Ci przewozić rowery samochodem osobowym?;;2;2;2072
951;Czy za tym znakiem informacyjnym, prawym pasem ruchu mogą poruszać się jedynie uprawnione pojazdy?;9148orgbm.jpg;1;1;2073
952;Czy w tej sytuacji, zgodnie z zasadą ograniczonego zaufania, należy rozpocząć hamowanie?;AK_D08-03_18_org_2.wmv;2;1;2075
953;"Czy widoczny na jezdni napis ""STOP"" potwierdza oznakowanie wlotu na skrzyżowanie znakiem pionowym ""stop""?";0288D14MM_aorgbm.jpg;1;1;2077
954;Czy w przedstawionej sytuacji masz prawo skręcić w lewo?;065bD11orgbez maski.jpg;3;1;2080
955;Czy w tej sytuacji wolno Ci skręcić w prawo?;IMG_9402aorgbm.jpg;2;1;2082
956;Czy w tej sytuacji z pasa ruchu, który zajmujesz, dozwolone jest wykonanie skrętu w prawo?;IMG_3170orgbm.jpg;2;1;2083
957;Czy wjeżdżając z pola na drogę twardą masz obowiązek zachować szczególną ostrożność?;D36_35org.wmv;2;1;2085
958;Czy w tej sytuacji masz obowiązek zachować szczególną ostrożność?;D18_6org.wmv;2;1;2087
959;Czy w tej sytuacji powinieneś być przygotowany do zatrzymania pojazdu?;2965orgbm.jpg;3;1;2089
960;Czy w tej sytuacji uzasadnione jest zmniejszenie prędkości podczas omijania?;W13(25).wmv;2;1;2091
961;Czy w tej sytuacji masz prawo jechać z włączonymi światłami drogowymi?;B.1.6.6.Bzorgbezmaski.wmv;1;1;2094
962;Czy w tej sytuacji zamiast świateł mijania wolno Ci używać świateł do jazdy dziennej?;W14(30).wmv;1;1;2095
963;Czy w tej sytuacji powinieneś użyć sygnału dźwiękowego?;W17(14,18,19)org.wmv;3;1;2098
964;Czy na tak oznakowanej drodze wolno Ci poruszać się autobusem o nacisku osi pojedynczej wynoszącym 10 ton?;IMG_3747d8_org poprawione1.jpg;1;1;2099
965;Kierujesz autobusem wykonującym odpłatny przewóz osób na regularnych liniach. Czy w tej sytuacji wolno Ci korzystać w dowolnym czasie z prawego pasa ruchu?;IMG_0238b_org.jpg;1;1;2101
966;Czy w tej sytuacji, umieszczone po prawej stronie na linii przerywanej odblaskowe elementy punktowe barwy białej rozdzielają pasy ruchu?;IMG_9746org.jpg;1;1;2103
967;Zamierzasz skręcić w lewo, a pojazd nadjeżdżający z prawej strony chce jechać na wprost. Czy masz przed nim pierwszeństwo?;KW_D22_454_org.wmv;3;1;2106
968;Czy w tej sytuacji, parkując autobusem o długości 6 m, właściwie użyłeś świateł postojowych?;IMG_8308borgbm poprawione1.jpg;1;1;2107
969;Czy na tak oznakowanej drodze dozwolone jest poruszanie się samochodem ciężarowym o nacisku osi pojedynczej wynoszącym 10 ton?;IMG_3747d8_org poprawione1.jpg;1;1;2109
970;Czy w tej sytuacji, parkując ciągnikiem na drodze, masz obowiązek włączyć światła pozycyjne lub światła postojowe?;IMG_8318orgbm.jpg;1;1;2111
971;Czy tak pozostawiony na postoju bez opieki ciągnik jest prawidłowo zabezpieczony przed możliwością uruchomienia go przez osobę niepowołaną?;IMG_5772_1org.jpg;2;1;2114
972;Czy podczas postoju wolno Ci oddalić się od ciągnika, jeśli silnik jest w ruchu?;IMG_5770_1org.jpg;2;1;2116
973;Czy tak pozostawiony na postoju bez opieki motocykl jest prawidłowo zabezpieczony przed możliwością uruchomienia go przez osobę niepowołaną?;IMG_0014org.jpg;2;1;2118
974;Czy podczas postoju wolno Ci oddalić się od motocykla, jeśli silnik jest w ruchu?;IMG_6164org.jpg;2;1;2120
975;Czy tak pozostawiony na postoju bez opieki autobus jest prawidłowo zabezpieczony przed możliwością uruchomienia go przez osobę niepowołaną?;D35_04org.jpg;2;1;2122
976;Czy tak pozostawiony na postoju bez opieki pojazd jest prawidłowo zabezpieczony przed możliwością uruchomienia go przez osobę niepowołaną?;D34_004org.jpg;2;1;2124
977;Czy podczas postoju wolno Ci oddalić się od pojazdu, jeśli silnik jest w ruchu?;IMG_6160org.jpg;2;1;2126
978;Czy podczas postoju wolno Ci oddalić się od autobusu, jeśli silnik jest w ruchu?;D35_06org.jpg;2;1;2128
979;Czy tak pozostawiony na postoju bez opieki pojazd jest prawidłowo zabezpieczony przed możliwością uruchomienia go przez osobę niepowołaną?;Sequence01_6org.wmv;2;1;2130
980;Zamierzasz skręcić w prawo. Czy masz obowiązek ustąpić pierwszeństwa pojazdowi nadjeżdżającemu z lewej strony?;504_D27KW_org_2.wmv;3;1;2131
981;W którym z wymienionych przypadków regularne wykonywanie badania technicznego pojazdu ma wpływ na jego bezpieczne używanie w ruchu drogowym?;;1;2;2135
982;Zamierzasz jechać na wprost. Czy masz obowiązek ustąpić pierwszeństwa pojazdowi nadjeżdżającemu z lewej strony?;KW_D16_356org_2.wmv;3;1;2137
983;Skręcasz w prawo, a kierujący nadjeżdżający z przeciwka zamierza skręcić w lewo. Czy masz przed nim pierwszeństwo?;KW_D22_436_org_2.wmv;3;1;2138
984;O czym ostrzega, świecąca się na czerwono w czasie jazdy samochodem osobowym, lampka kontrolna z symbolem akumulatora?;B9(42)org.jpg;1;2;2142
985;Który z wymienionych skutków może zostać wywołany przez kontynuowanie jazdy przy świecącej się na czerwono lampce kontrolnej ciśnienia oleju silnikowego?;B9(41,43,44)org.jpg;1;2;2143
986;Która osoba ma obowiązek korzystania z pasów bezpieczeństwa?;B2(27,28,30,31)org.jpg;3;2;2147
987;Jaką funkcję pełni dobrze ustawiony zagłówek w razie wypadku drogowego?;B2(29)org.jpg;3;2;2150
988;Jaki wpływ ma stosowanie pasów bezpieczeństwa na powstanie obrażeń ciężkich przy zderzeniach czołowych?;B2(27,28,30,31)org.jpg;3;2;2152
989;W której sytuacji zapięty pas bezpieczeństwa nie będzie działał właściwie?;B2(27,28,30,31)org.jpg;3;2;2155
990;Czy w tej sytuacji miałeś obowiązek włączyć kierunkowskaz?;MD_D15c_07-00_org_2.wmv;2;1;2158
991;Jaki jest cel stosowania systemu ABS w samochodzie osobowym?;;2;2;2160
992;Jak należy postąpić, podczas jazdy samochodem osobowym po drodze pokrytej śniegiem?;;3;2;2163
993;Czy znak umieszczony pod sygnalizacją oznacza zakaz wjazdu na zwrotnicę oraz obowiązek zatrzymania się i sprawdzenia prawidłowego położenia iglic?;115TRAM3org.jpg;3;1;2166
994;Czy widoczna na jezdni linia łamana wyznacza miejsce przystanku dla tramwajów, autobusów lub trolejbusów?;133TRAM3Porg3po korekcie.jpg;1;1;2168
995;Czy w tej sytuacji skręcając w lewo masz obowiązek ustąpić pierwszeństwa tramwajowi z przeciwka?;018TRAM1org.wmv;3;1;2170
996;"Czy widoczny na jezdni znak ""linia łamana"" wyznacza miejsce parkingowe dla niepełnosprawnych?";133TRAM3Porg3po korekcie.jpg;1;1;2173
997;Czy w tej sytuacji wykonujesz manewr wyprzedzania?;027TRAM3org.wmv;2;1;2174
998;Czy w takiej sytuacji masz pierwszeństwo przed pieszym?;045TRAM1Porg.jpg;3;1;2177
999;Jak powinien zachować się motorniczy przy narastającym natężeniu ruchu?;;3;2;2180
1000;"Na czym polega zjawisko ""pocenia się szyn""?";;3;2;2182
1001;Jak powinien zachować się kierujący tramwajem, gdy zaczyna padać deszcz?;;3;2;2184
1002;Co powinien zrobić motorniczy przed wjechaniem na zwrotnicę?;119TRAM2org.jpg;3;2;2188
1003;Co powinien zrobić motorniczy widząc sygnalizator informujący o przestawieniu zwrotnicy w prawo?;119TRAM2org.jpg;3;2;2190
1004;Na czym polega prawidłowa technika kierowania tramwajem?;;2;2;2195
1005;Kto podlega odpowiedzialności karnej w przypadku nieudzielenia pomocy poszkodowanemu w wypadku drogowym z bezpośrednim zagrożeniu utraty zdrowia i życia?;;3;2;2196
1006;Jak należy postąpić z poszkodowanym w wypadku drogowym, znajdującym się w pojeździe?;;3;2;2200
1007;Czy, ograniczenie prędkości określone przez ten znak obowiązuje motorniczego wyłącznie do najbliższego skrzyżowania bądź przecięcia torów, o ile inne znaki nie nakażą inaczej?;166TRAM1org.jpg;3;1;2202
1008;Czy w tej sytuacji masz prawo wjechać za sygnalizator?;149TRAM1orgpo korkecie.jpg;2;1;2205
1009;Jesteś uczestnikiem lub świadkiem wypadku drogowego. Które z wymienionych informacji należy podać dzwoniąc pod numer alarmowy?;;3;2;2206
1010;Jesteś uczestnikiem lub świadkiem wypadku drogowego. Jak należy postąpić, gdy na poszkodowanym pali się ubranie?;;3;2;2209
1011;Która z wymienionych awarii, uniemożliwia używanie samochodu osobowego w ruchu drogowym?;;1;2;2214
1012;Które z wymienionych działań należy podjąć w pierwszej kolejności, gdy w czasie jazdy zaświeci się na czerwono lampka kontrolna ciśnienia oleju silnikowego?;;1;2;2217
1013;Czy zajmujesz właściwy pas ruchu, jeśli na najbliższym skrzyżowaniu zamierzasz skręcić w lewo?;Zmiana_pasa_ruchu_53 P.jpg;2;1;2219
1014;Czy w tych warunkach drogowych przedstawiony sposób wykonania manewru zawracania jest zabroniony?;MD_D15c_07-03org.wmv;2;1;2221
1015;Czy w przedstawionej sytuacji wolno Ci wyprzedzić pojazd z prawej strony?;WC_D17_27_org_2.wmv;3;1;2222
1017;Co powinieneś zrobić jeżeli na skutek wypadku drogowego, wokół tramwaju zbiera się paliwo wyciekające z uszkodzonych pojazdów?;;2;2;2224
1019;Czy w tej sytuacji masz prawo wjechać na skrzyżowanie, jeżeli zamierzasz jechać na wprost?;1A351.wmv;3;1;2227
1020;Z jaką prędkością masz obowiązek jechać na autostradzie?;2A109.jpg;3;2;2231
1021;Czy jadąc motorowerem masz obowiązek używać kasku ochronnego?;3A257.jpg;3;2;2232
1022;Czy przed wjazdem na przejazd kolejowy oznaczony tym znakiem, zawsze masz obowiązek zatrzymania się?;1A1106.jpg;2;1;2236
1023;Czy widoczne znaki ostrzegają o zbliżaniu się do przejścia dla pieszych?;1A1117.wmv;2;1;2238
1024;Czy za tymi znakami powinieneś spodziewać się dwustronnego zwężenia jezdni?;1A1118.wmv;2;1;2239
1025;Czy ten znak ostrzega o miejscu intensywnych opadów atmosferycznych?;1A1121.jpg;2;1;2242
1026;Czy ten znak ostrzega o możliwości poślizgu pojazdu spowodowanego zawilgoceniem jezdni?;1A1122.jpg;2;1;2244
1027;Czy ten znak ostrzega o możliwości wystąpienia gołoledzi na jezdni?;1A1123.jpg;2;1;2245
